{
  "loop_id": "ACU-LOOP-0096",
  "issue_number": 96,
  "mode": "controlled_implementation",
  "status": "completed",
  "phase": "low-confidence-review-ux",
  "created_at_utc": "2026-05-17T00:00:00+00:00",
  "updated_at_utc": "2026-05-17T00:00:00+00:00",
  "validation": {
    "methodology": {
      "status": "passed",
      "command": "python3 scripts/validate_atlante_methodology.py",
      "return_code": 0
    },
    "golden_dataset": {
      "status": "passed",
      "command": "python3 scripts/validate_golden_dataset.py",
      "return_code": 0
    },
    "state_schema": {
      "status": "passed",
      "command": "python3 scripts/validate_agentic_loop_state.py",
      "return_code": 0
    }
  },
  "human_review_required": false,
  "files_touched": [
    "site/index.html",
    "docs/executions/ACU-LOOP-0096_execution.md",
    "reports/agentic-loop/ACU-LOOP-0096_state.json"
  ],
  "next_action": "Open draft PR titled 'Add bulk approval workflow to low-confidence review UX'.",
  "blocking_issues": [],
  "allowed_actions": [
    "Implement controlled UX updates for low-confidence manual review",
    "Export review decisions in repository-compatible schema",
    "Run repository validators and record execution evidence"
  ],
  "prohibited_actions": [
    "Modify golden dataset rows",
    "Infer wrongdoing/legal conclusions",
    "Add raw documents/snapshots"
  ],
  "quality_score": 1
}