{
  "loop_id": "ACU-LOOP-0063",
  "issue_number": 61,
  "mode": "controlled_implementation",
  "status": "blocked",
  "phase": "controlled_implementation",
  "created_at_utc": "2026-05-17T10:25:00+00:00",
  "updated_at_utc": "2026-05-17T10:25:00+00:00",
  "allowed_actions": [
    "read_repository",
    "write_loop_state",
    "write_execution_log",
    "run_validation",
    "audit_registry_coverage"
  ],
  "prohibited_actions": [
    "large_scale_scraping",
    "unapproved_domain_expansion",
    "legal_conclusions",
    "raw_document_commit",
    "golden_dataset_modification"
  ],
  "quality_score": 92,
  "validation": {
    "state_schema": {
      "status": "passed",
      "command": "python3 scripts/validate_agentic_loop_state.py",
      "return_code": 0,
      "summary": "Result: PASSED"
    },
    "methodology": {
      "status": "passed",
      "command": "python3 scripts/validate_atlante_methodology.py",
      "return_code": 0,
      "summary": "Validation passed"
    },
    "golden_dataset": {
      "status": "passed",
      "command": "python3 scripts/validate_golden_dataset.py",
      "return_code": 0,
      "summary": "Result: PASSED (warnings preserved)"
    }
  },
  "blocking_issues": [
    "Canonical MUR category pages intermittently return HTTP 403 from this environment, preventing deterministic name-by-name missing list reconciliation."
  ],
  "human_review_required": true,
  "next_action": "Run a controlled reconciliation pass against full canonical MUR category lists and publish the exact missing/unmatched table.",
  "files_touched": [
    "docs/executions/ACU-LOOP-0063_execution.md",
    "reports/agentic-loop/ACU-LOOP-0063_state.json"
  ],
  "last_commit": null,
  "last_pr": null,
  "notes": [
    "Audit-only run; no registry data rows changed.",
    "Issue #61 remains open pending full canonical reconciliation."
  ]
}
