{
  "loop_id": "ACU-LOOP-0079",
  "issue_number": 79,
  "mode": "controlled_implementation",
  "status": "completed",
  "phase": "implementation",
  "created_at_utc": "2026-05-17T15:05:00+00:00",
  "updated_at_utc": "2026-05-17T16:05:00+00:00",
  "allowed_actions": [
    "Implement approved UX-only mapping progress tracker",
    "Generate deterministic history artifacts",
    "Run required validators"
  ],
  "prohibited_actions": [
    "Golden dataset modification without explicit authorization",
    "Raw document/snapshot commits",
    "Unapproved scope expansion beyond issue text"
  ],
  "validation": {
    "state_schema": {
      "status": "passed",
      "command": "python3 scripts/validate_agentic_loop_state.py",
      "return_code": 0
    },
    "methodology": {
      "status": "passed",
      "command": "python3 scripts/validate_atlante_methodology.py",
      "return_code": 0
    },
    "golden_dataset": {
      "status": "passed",
      "command": "python3 scripts/validate_golden_dataset.py",
      "return_code": 0
    }
  },
  "human_review_required": true,
  "next_action": "Open draft PR and request review of milestone labels/timeline wording.",
  "files_touched": [
    "site/index.html",
    "site/README.md",
    "site/data/university_registry.json",
    "site/data/mapping_progress_history.json",
    "scripts/build_mapping_progress_history.py",
    "docs/executions/ACU-LOOP-0079_execution.md",
    "reports/agentic-loop/ACU-LOOP-0079_state.json"
  ],
  "notes": [
    "Progress tracker intentionally avoids declaring full completion while 19-row reconciliation backlog exists.",
    "Competition/procedure source history remains placeholder-only (0/0) pending future controlled expansion."
  ],
  "quality_score": 91,
  "blocking_issues": []
}
