{
  "loop_id": "ACU-LOOP-0061",
  "issue_number": 61,
  "mode": "controlled_implementation",
  "status": "completed",
  "phase": "controlled_implementation",
  "created_at_utc": "2026-05-17T09:11:48+00:00",
  "updated_at_utc": "2026-05-17T09:40:00+00:00",
  "allowed_actions": [
    "read_repository",
    "write_loop_state",
    "write_execution_log",
    "run_validation",
    "prepare_controlled_source_registry"
  ],
  "prohibited_actions": [
    "large_scale_scraping",
    "unapproved_domain_expansion",
    "legal_conclusions",
    "raw_document_commit",
    "golden_dataset_modification"
  ],
  "quality_score": 96,
  "validation": {
    "state_schema": {
      "status": "passed",
      "command": "python3 scripts/validate_agentic_loop_state.py",
      "return_code": 0,
      "summary": "Result: PASSED"
    },
    "methodology": {
      "status": "passed",
      "command": "python3 scripts/validate_atlante_methodology.py",
      "return_code": 0,
      "summary": "Validation passed"
    },
    "golden_dataset": {
      "status": "passed",
      "command": "python3 scripts/validate_golden_dataset.py",
      "return_code": 0,
      "summary": "Result: PASSED (warnings preserved)"
    }
  },
  "blocking_issues": [],
  "human_review_required": true,
  "next_action": "Continue controlled expansion to full recognised-university universe and manually verify uncertain recruitment endpoints.",
  "files_touched": [
    "data/source-registries/italian-universities/official_university_urls.csv",
    "data/source-registries/italian-universities/README.md",
    "data/source-registries/italian-universities/source_methodology.md",
    "data/source-registries/italian-universities/verification_notes.md",
    "docs/executions/ACU-LOOP-0061_execution.md",
    "reports/agentic-loop/ACU-LOOP-0061_state.json"
  ],
  "last_commit": null,
  "last_pr": null,
  "notes": [
    "Expanded beyond bootstrap subset toward broad national coverage.",
    "No golden-dataset rows or raw documents changed."
  ]
}
