{
  "loop_id": "ACU-LOOP-0098",
  "issue_number": 98,
  "mode": "controlled_implementation",
  "status": "completed",
  "phase": "manual-review-github-submission",
  "created_at_utc": "2026-05-17T00:00:00+00:00",
  "updated_at_utc": "2026-05-17T00:00:00+00:00",
  "validation": {
    "methodology": {
      "status": "passed",
      "command": "python3 scripts/validate_atlante_methodology.py",
      "return_code": 0
    },
    "golden_dataset": {
      "status": "passed",
      "command": "python3 scripts/validate_golden_dataset.py",
      "return_code": 0
    },
    "state_schema": {
      "status": "passed",
      "command": "python3 scripts/validate_agentic_loop_state.py",
      "return_code": 0
    }
  },
  "human_review_required": false,
  "files_touched": [
    "site/index.html",
    "docs/executions/ACU-LOOP-0098_execution.md",
    "reports/agentic-loop/ACU-LOOP-0098_state.json"
  ],
  "next_action": "Open draft PR titled 'Add GitHub issue submission flow for manual review decisions'.",
  "blocking_issues": [],
  "allowed_actions": [
    "Implement static-safe GitHub issue submission UX for manual review decisions",
    "Preserve existing decision export workflows",
    "Run repository validators and record execution evidence"
  ],
  "prohibited_actions": [
    "Modify golden dataset rows",
    "Infer wrongdoing/legal conclusions",
    "Add raw documents/snapshots"
  ],
  "quality_score": 1
}
