{
  "loop_id": "ACU-LOOP-0065",
  "issue_number": 72,
  "mode": "controlled_implementation",
  "status": "completed",
  "phase": "implementation",
  "created_at_utc": "2026-05-17T12:40:00+00:00",
  "updated_at_utc": "2026-05-17T12:40:00+00:00",
  "allowed_actions": [
    "Add scheduled dispatcher automation",
    "Add scheduled continuation evaluator automation",
    "Update methodology documentation",
    "Run required validators"
  ],
  "prohibited_actions": [
    "Dataset expansion",
    "Unapproved source-domain expansion",
    "Legal or reputational judgement automation"
  ],
  "quality_score": 92,
  "validation": {
    "state_schema": {
      "status": "passed",
      "command": "python3 scripts/validate_agentic_loop_state.py",
      "return_code": 0
    },
    "methodology": {
      "status": "passed",
      "command": "python3 scripts/validate_atlante_methodology.py",
      "return_code": 0
    },
    "golden_dataset": {
      "status": "passed",
      "command": "python3 scripts/validate_golden_dataset.py",
      "return_code": 0
    }
  },
  "blocking_issues": [
    "Repository has no local 'main' branch reference; dedicated branch created from current working branch instead."
  ],
  "human_review_required": true,
  "next_action": "Review scheduled workflows in GitHub Actions and confirm cadence/label transitions under controlled governance.",
  "files_touched": [
    ".github/workflows/agentic-dispatcher.yml",
    ".github/workflows/agentic-continuation-evaluator.yml",
    "docs/agentic-loop/03_dispatcher_model.md",
    "reports/agentic-loop/ACU-LOOP-0065_state.json",
    "docs/executions/ACU-LOOP-0065_execution.md"
  ],
  "notes": [
    "Automation remains label-scoped and signal-based.",
    "No substantive dataset files were changed.",
    "Human review remains mandatory before any agent-done closure."
  ]
}
