{
  "loop_id": "ACU-LOOP-0050",
  "issue_number": 50,
  "mode": "controlled_implementation",
  "status": "completed",
  "phase": "controlled_implementation",
  "created_at_utc": "2026-05-16T21:53:56+00:00",
  "updated_at_utc": "2026-05-16T21:53:56+00:00",
  "allowed_actions": [
    "read_repository",
    "read_issue_instruction",
    "write_loop_state",
    "write_execution_log",
    "run_validation",
    "report_blockers",
    "prepare_empty_review_checklist",
    "prepare_procedure_review_pack"
  ],
  "prohibited_actions": [
    "large_scale_scraping",
    "unapproved_domain_expansion",
    "public_accusatory_language",
    "legal_conclusions",
    "raw_document_commit",
    "substantive_dataset_expansion_in_dry_run",
    "substantive_dataset_expansion_in_controlled_implementation",
    "relation_inference_without_human_review"
  ],
  "quality_score": 100,
  "validation": {
    "state_schema": {
      "status": "passed",
      "command": "/opt/hostedtoolcache/Python/3.11.15/x64/bin/python scripts/validate_agentic_loop_state.py",
      "return_code": 0,
      "summary": "Agentic loop state validation report\n--------------------------------------\nResult: PASSED (2 state file(s))"
    },
    "methodology": {
      "status": "passed",
      "command": "/opt/hostedtoolcache/Python/3.11.15/x64/bin/python scripts/validate_atlante_methodology.py",
      "return_code": 0,
      "summary": "Validation passed: expected files, JSON parsing, and schema/CSV header alignment are OK."
    },
    "golden_dataset": {
      "status": "passed",
      "command": "/opt/hostedtoolcache/Python/3.11.15/x64/bin/python scripts/validate_golden_dataset.py",
      "return_code": 0,
      "summary": "nsure this is intentional and approved for internal pilot use.\nWARN: Row may contain non-synthetic data [candidates] line 22. Ensure this is intentional and approved for internal pilot use.\nWARN: Row may contain non-synthetic data [candidates] line 23. Ensure this is intentional and approved for internal pilot use.\nWARN: Row may contain non-synthetic data [candidates] line 24. Ensure this is intentional and approved for internal pilot use.\nWARN: Row may contain non-synthetic data [committee_candidate_relations] line 2. Ensure this is intentional and approved for internal pilot use.\nWARN: Row may contain non-synthetic data [committee_candidate_relations] line 3. Ensure this is intentional and approved for internal pilot use.\nWARN: Row may contain non-synthetic data [committee_candidate_relations] line 4. Ensure this is intentional and approved for internal pilot use.\nWARN: Row may contain non-synthetic data [committee_candidate_relations] line 5. Ensure this is intentional and approved for internal pilot use.\nWARN: Row may contain non-synthetic data [committee_candidate_relations] line 6. Ensure this is intentional and approved for internal pilot use.\nResult: PASSED (367 warning(s))"
    }
  },
  "blocking_issues": [],
  "human_review_required": false,
  "next_action": "Review the generated procedure review pack, then decide whether a later human-approved substantive coding task is appropriate.",
  "files_touched": [
    "docs/executions/ACU-LOOP-0050_execution.md",
    "docs/executions/procedure-review-packs/ACU-REVIEW-PACK-PLACEHOLDER/README.md",
    "docs/executions/procedure-review-packs/ACU-REVIEW-PACK-PLACEHOLDER/coding_plan.md",
    "docs/executions/procedure-review-packs/ACU-REVIEW-PACK-PLACEHOLDER/handoff.md",
    "docs/executions/procedure-review-packs/ACU-REVIEW-PACK-PLACEHOLDER/human_review_notes.md",
    "docs/executions/procedure-review-packs/ACU-REVIEW-PACK-PLACEHOLDER/source_inventory.md",
    "reports/agentic-loop/ACU-LOOP-0050_state.json"
  ],
  "last_commit": null,
  "last_pr": null,
  "notes": [
    "No source expansion, no data collection, no relation inference and no golden-dataset update.",
    "Substantive coding mode remains disabled unless explicitly approved through a reviewed issue.",
    "Created a neutral procedure review pack for later human use."
  ]
}
