{
  "loop_id": "ACU-LOOP-0059",
  "issue_number": 59,
  "mode": "controlled_implementation",
  "status": "completed",
  "phase": "controlled_implementation",
  "created_at_utc": "2026-05-16T23:18:13+00:00",
  "updated_at_utc": "2026-05-16T23:18:13+00:00",
  "allowed_actions": [
    "read_repository",
    "read_issue_instruction",
    "write_loop_state",
    "write_execution_log",
    "run_validation",
    "report_blockers",
    "prepare_controlled_source_registry"
  ],
  "prohibited_actions": [
    "large_scale_scraping",
    "unapproved_domain_expansion",
    "public_accusatory_language",
    "legal_conclusions",
    "raw_document_commit",
    "golden_dataset_modification",
    "relation_inference_without_human_review"
  ],
  "quality_score": 93,
  "validation": {
    "state_schema": {
      "status": "passed",
      "command": "python3 scripts/validate_agentic_loop_state.py",
      "return_code": 0,
      "summary": "Result: PASSED"
    },
    "methodology": {
      "status": "passed",
      "command": "python3 scripts/validate_atlante_methodology.py",
      "return_code": 0,
      "summary": "Validation passed: expected files, JSON parsing, and schema/CSV header alignment are OK."
    },
    "golden_dataset": {
      "status": "passed",
      "command": "python3 scripts/validate_golden_dataset.py",
      "return_code": 0,
      "summary": "Result: PASSED (367 warning(s))"
    }
  },
  "blocking_issues": [],
  "human_review_required": true,
  "next_action": "Expand from bootstrap subset to full recognised-university universe using an approved institutional master list.",
  "files_touched": [
    "data/source-registries/italian-universities/official_university_urls.csv",
    "data/source-registries/italian-universities/README.md",
    "data/source-registries/italian-universities/source_methodology.md",
    "data/source-registries/italian-universities/verification_notes.md",
    "docs/executions/ACU-LOOP-0059_execution.md",
    "reports/agentic-loop/ACU-LOOP-0059_state.json"
  ],
  "last_commit": null,
  "last_pr": null,
  "notes": [
    "Bootstrap registry created without touching golden dataset.",
    "Uncertainty preserved through verification_status and notes.",
    "No raw documents or person-level data collected."
  ]
}